{
  "$schema": "https://json-schema.org/draft/2020-12/schema",
  "$id": "https://raw.githubusercontent.com/Map1en/VRCX-0-Community-Themes/master/schemas/theme.schema.json",
  "title": "VRCX-0 Community Theme Manifest",
  "type": "object",
  "additionalProperties": false,
  "required": [
    "id",
    "name",
    "version",
    "author",
    "description",
    "tags",
    "testedWith",
    "remoteAssets",
    "accentMode"
  ],
  "properties": {
    "id": {
      "type": "string",
      "pattern": "^[a-z0-9]+(?:-[a-z0-9]+)*$"
    },
    "name": {
      "type": "string",
      "minLength": 1,
      "maxLength": 80
    },
    "version": {
      "type": "string",
      "pattern": "^([1-9]\\d*)\\.(0|[1-9]\\d*)\\.(0|[1-9]\\d*)(?:-[0-9A-Za-z.-]+)?(?:\\+[0-9A-Za-z.-]+)?$"
    },
    "author": {
      "type": "object",
      "additionalProperties": false,
      "required": ["name", "github"],
      "properties": {
        "name": {
          "type": "string",
          "minLength": 1,
          "maxLength": 80
        },
        "github": {
          "type": "string",
          "pattern": "^[A-Za-z0-9](?:[A-Za-z0-9-]{0,37}[A-Za-z0-9])?$"
        },
        "url": {
          "type": "string",
          "format": "uri",
          "maxLength": 240
        }
      }
    },
    "description": {
      "type": "string",
      "minLength": 1,
      "maxLength": 240
    },
    "tags": {
      "type": "array",
      "items": {
        "type": "string",
        "minLength": 1,
        "maxLength": 24
      },
      "uniqueItems": true,
      "minItems": 1,
      "maxItems": 3
    },
    "testedWith": {
      "type": "string",
      "pattern": "^[0-9]+\\.[0-9]+\\.[0-9]+(?:-[0-9A-Za-z.-]+)?$"
    },
    "remoteAssets": {
      "type": "boolean"
    },
    "accentMode": {
      "type": "boolean"
    }
  }
}
