{
  "id": "bing-daily-wallpaper",
  "name": "Bing Daily Wallpaper",
  "version": "1.0.0",
  "author": {
    "name": "Map1en",
    "github": "Map1en"
  },
  "description": "Background-only theme using the current Bing daily wallpaper.",
  "tags": ["bing", "daily", "wallpaper"],
  "testedWith": "2.2.1",
  "remoteAssets": true,
  "accentMode": true
}
