{
  "id": "trans-theme-example",
  "name": "Trans Theme Example",
  "version": "1.0.0",
  "author": {
    "name": "Map1en",
    "github": "Map1en"
  },
  "description": "Diagonal trans pride flag background with readable translucent app surfaces.",
  "tags": ["trans", "pride", "gradient"],
  "testedWith": "2.2.1",
  "remoteAssets": false,
  "accentMode": false
}
