{
  "id": "darkblue-theme",
  "name": "Darkblue Theme",
  "version": "1.0.0",
  "author": {
    "name": "小槟哥",
    "github": "xiaoBingge114514",
    "url": "https://github.com/xiaoBingge114514"
  },

  "description": "Deep blue cohesive theme for VRCX-0 featuring a dark background, harmonized sidebar surfaces, and status bar.",
  "tags": ["dark", "blue", "minimal"],
  "testedWith": "2.2.1",
  "remoteAssets": false,
  "accentMode": false
}
